{
  "$schema": "../../contracts/jsonschema/feature-traceability.v1.schema.json",
  "manifest_id": "flowpilot-feature-traceability",
  "version": "1.0.0-rc.2",
  "status": "candidate",
  "source_of_truth": true,
  "features": [
    {
      "feature_id": "FP-FLOW-001",
      "priority": "P0",
      "implementation_owner": "S2-RUNTIME",
      "verification_owner": "S4-QUALITY",
      "observable_behavior": "LangGraph 是唯一业务状态机",
      "target_paths": [
        "packages/graph"
      ],
      "tests": [
        {
          "test_id": "test.fp-flow-001.primary.v1",
          "kind": "e2e",
          "path": "tests/runtime/e2e/test_state_authority.py"
        }
      ],
      "evidence": [
        {
          "evidence_id": "evidence.fp-flow-001.primary.v1",
          "type": "test_result",
          "path_pattern": "artifacts/acceptance/FP-FLOW-001/evidence.json",
          "description": "状态转换与写入路径断言"
        }
      ],
      "status": "DESIGNED",
      "valid_evidence_refs": []
    },
    {
      "feature_id": "FP-FLOW-002",
      "priority": "P0",
      "implementation_owner": "S2-RUNTIME",
      "verification_owner": "S4-QUALITY",
      "observable_behavior": "缺失字段触发追问并续跑",
      "target_paths": [
        "packages/graph/nodes"
      ],
      "tests": [
        {
          "test_id": "test.fp-flow-002.primary.v1",
          "kind": "e2e",
          "path": "tests/runtime/e2e/test_clarification.py"
        }
      ],
      "evidence": [
        {
          "evidence_id": "evidence.fp-flow-002.primary.v1",
          "type": "test_result",
          "path_pattern": "artifacts/acceptance/FP-FLOW-002/evidence.json",
          "description": "WAITING_USER 前后事件"
        }
      ],
      "status": "DESIGNED",
      "valid_evidence_refs": []
    },
    {
      "feature_id": "FP-FLOW-003",
      "priority": "P0",
      "implementation_owner": "S2-RUNTIME",
      "verification_owner": "S4-QUALITY",
      "observable_behavior": "知识/数据只读分支并行汇总",
      "target_paths": [
        "packages/graph"
      ],
      "tests": [
        {
          "test_id": "test.fp-flow-003.primary.v1",
          "kind": "e2e",
          "path": "tests/runtime/e2e/test_parallel_reads.py"
        }
      ],
      "evidence": [
        {
          "evidence_id": "evidence.fp-flow-003.primary.v1",
          "type": "trace_assertion",
          "path_pattern": "artifacts/acceptance/FP-FLOW-003/evidence.json",
          "description": "Trace 时间区间重叠"
        }
      ],
      "status": "DESIGNED",
      "valid_evidence_refs": []
    },
    {
      "feature_id": "FP-FLOW-004",
      "priority": "P0",
      "implementation_owner": "S2-RUNTIME",
      "verification_owner": "S4-QUALITY",
      "observable_behavior": "审批 Interrupt 与恢复",
      "target_paths": [
        "packages/graph"
      ],
      "tests": [
        {
          "test_id": "test.fp-flow-004.primary.v1",
          "kind": "recovery",
          "path": "tests/runtime/recovery/test_approval_resume.py"
        }
      ],
      "evidence": [
        {
          "evidence_id": "evidence.fp-flow-004.primary.v1",
          "type": "trace_assertion",
          "path_pattern": "artifacts/acceptance/FP-FLOW-004/evidence.json",
          "description": "Checkpoint + 两个 Run"
        }
      ],
      "status": "DESIGNED",
      "valid_evidence_refs": []
    },
    {
      "feature_id": "FP-FLOW-005",
      "priority": "P0",
      "implementation_owner": "S2-RUNTIME",
      "verification_owner": "S4-QUALITY",
      "observable_behavior": "服务重启从持久化 Checkpoint 恢复",
      "target_paths": [
        "apps/worker"
      ],
      "tests": [
        {
          "test_id": "test.fp-flow-005.primary.v1",
          "kind": "recovery",
          "path": "tests/runtime/recovery/test_worker_restart.py"
        }
      ],
      "evidence": [
        {
          "evidence_id": "evidence.fp-flow-005.primary.v1",
          "type": "operational_report",
          "path_pattern": "artifacts/acceptance/FP-FLOW-005/evidence.json",
          "description": "重启日志与节点计数"
        }
      ],
      "status": "DESIGNED",
      "valid_evidence_refs": []
    },
    {
      "feature_id": "FP-FLOW-006",
      "priority": "P0",
      "implementation_owner": "S2-RUNTIME",
      "verification_owner": "S4-QUALITY",
      "observable_behavior": "死循环、步骤和成本预算终止",
      "target_paths": [
        "packages/graph"
      ],
      "tests": [
        {
          "test_id": "test.fp-flow-006.primary.v1",
          "kind": "e2e",
          "path": "tests/runtime/e2e/test_budget_limits.py"
        }
      ],
      "evidence": [
        {
          "evidence_id": "evidence.fp-flow-006.primary.v1",
          "type": "test_result",
          "path_pattern": "artifacts/acceptance/FP-FLOW-006/evidence.json",
          "description": "escalation 事件"
        }
      ],
      "status": "DESIGNED",
      "valid_evidence_refs": []
    },
    {
      "feature_id": "FP-FLOW-007",
      "priority": "P0",
      "implementation_owner": "S2-RUNTIME",
      "verification_owner": "S4-QUALITY",
      "observable_behavior": "可恢复失败重试、业务失败不盲重试",
      "target_paths": [
        "packages/application"
      ],
      "tests": [
        {
          "test_id": "test.fp-flow-007.primary.v1",
          "kind": "recovery",
          "path": "tests/runtime/recovery/test_retry_matrix.py"
        }
      ],
      "evidence": [
        {
          "evidence_id": "evidence.fp-flow-007.primary.v1",
          "type": "test_result",
          "path_pattern": "artifacts/acceptance/FP-FLOW-007/evidence.json",
          "description": "每类错误调用次数"
        }
      ],
      "status": "DESIGNED",
      "valid_evidence_refs": []
    },
    {
      "feature_id": "FP-FLOW-008",
      "priority": "P1",
      "implementation_owner": "S2-RUNTIME",
      "verification_owner": "S4-QUALITY",
      "observable_behavior": "显式补偿动作",
      "target_paths": [
        "packages/application"
      ],
      "tests": [
        {
          "test_id": "test.fp-flow-008.primary.v1",
          "kind": "e2e",
          "path": "tests/runtime/e2e/test_compensation.py"
        }
      ],
      "evidence": [
        {
          "evidence_id": "evidence.fp-flow-008.primary.v1",
          "type": "test_result",
          "path_pattern": "artifacts/acceptance/FP-FLOW-008/evidence.json",
          "description": "原动作与补偿审计"
        }
      ],
      "status": "DESIGNED",
      "valid_evidence_refs": []
    },
    {
      "feature_id": "FP-FLOW-009",
      "priority": "P0",
      "implementation_owner": "S2-RUNTIME",
      "verification_owner": "S4-QUALITY",
      "observable_behavior": "命令使用版本检查与逻辑去重，不能直接篡改任务状态",
      "target_paths": [
        "packages/application"
      ],
      "tests": [
        {
          "test_id": "test.fp-flow-009.primary.v1",
          "kind": "contract",
          "path": "tests/runtime/contract/test_command_concurrency.py"
        }
      ],
      "evidence": [
        {
          "evidence_id": "evidence.fp-flow-009.primary.v1",
          "type": "test_result",
          "path_pattern": "artifacts/acceptance/FP-FLOW-009/evidence.json",
          "description": "冲突与重复命令断言"
        }
      ],
      "status": "DESIGNED",
      "valid_evidence_refs": []
    },
    {
      "feature_id": "FP-AGT-001",
      "priority": "P0",
      "implementation_owner": "S2-RUNTIME",
      "verification_owner": "S4-QUALITY",
      "observable_behavior": "知识/数据/规划 Agent 职责与工具隔离",
      "target_paths": [
        "packages/agent-runtime"
      ],
      "tests": [
        {
          "test_id": "test.fp-agt-001.primary.v1",
          "kind": "integration",
          "path": "tests/runtime/integration/test_agent_tool_scope.py"
        }
      ],
      "evidence": [
        {
          "evidence_id": "evidence.fp-agt-001.primary.v1",
          "type": "test_result",
          "path_pattern": "artifacts/acceptance/FP-AGT-001/evidence.json",
          "description": "每 Agent 工具清单"
        }
      ],
      "status": "DESIGNED",
      "valid_evidence_refs": []
    },
    {
      "feature_id": "FP-AGT-002",
      "priority": "P0",
      "implementation_owner": "S2-RUNTIME",
      "verification_owner": "S4-QUALITY",
      "observable_behavior": "OpenAI/Claude Runtime 遵循统一端口",
      "target_paths": [
        "packages/agent-runtime"
      ],
      "tests": [
        {
          "test_id": "test.fp-agt-002.primary.v1",
          "kind": "contract",
          "path": "tests/runtime/contract/test_runtime_port.py"
        }
      ],
      "evidence": [
        {
          "evidence_id": "evidence.fp-agt-002.primary.v1",
          "type": "contract_report",
          "path_pattern": "artifacts/acceptance/FP-AGT-002/evidence.json",
          "description": "Conformance 报告"
        }
      ],
      "status": "DESIGNED",
      "valid_evidence_refs": []
    },
    {
      "feature_id": "FP-AGT-003",
      "priority": "P0",
      "implementation_owner": "S2-RUNTIME",
      "verification_owner": "S4-QUALITY",
      "observable_behavior": "一个节点只使用一个 Provider",
      "target_paths": [
        "packages/graph"
      ],
      "tests": [
        {
          "test_id": "test.fp-agt-003.primary.v1",
          "kind": "integration",
          "path": "tests/runtime/integration/test_provider_selection.py"
        }
      ],
      "evidence": [
        {
          "evidence_id": "evidence.fp-agt-003.primary.v1",
          "type": "trace_assertion",
          "path_pattern": "artifacts/acceptance/FP-AGT-003/evidence.json",
          "description": "Trace Provider 断言"
        }
      ],
      "status": "DESIGNED",
      "valid_evidence_refs": []
    },
    {
      "feature_id": "FP-AGT-004",
      "priority": "P1",
      "implementation_owner": "S2-RUNTIME",
      "verification_owner": "S4-QUALITY",
      "observable_behavior": "Handoff 不跨审批/执行边界",
      "target_paths": [
        "packages/agent-runtime"
      ],
      "tests": [
        {
          "test_id": "test.fp-agt-004.primary.v1",
          "kind": "integration",